<?xml version="1.0" encoding="UTF-8"?>
<!DOCTYPE elasticMapper SYSTEM "elasticmapping.dtd">
<elasticMapper name="diagnose">
    <!--property配置字段映射信息
        sourceName：源字段名称
        targetName: 目标字段名称
        convert： 是否进行转换， 如果true, 则将通过调用方法或者动态执行sql获取转换后的值
        valueType: 字段数据类型，
        dicType: 字典类型   com.example.demo.core.dics 包下的类路径
        -->
    <property sourceName="ord_id"  targetName="Ord_Id" valueType="String" idField="true"></property>
    <property sourceName="ord_admno" targetName="Ord_AdmNo" valueType="String" parentField="true"></property>
    <property sourceName="ord_regno" targetName="Ord_RegNo" valueType="String" routingField="true"></property>
    <!--医嘱代码-->
    <property sourceName="ord_code" targetName="Ord_DicCode"  valueType="String"></property>
    <!--医嘱名称-->
    <property sourceName="ord_code" targetName="Ord_Name" valueType="String">
        <dicConvertor methodName="getByCode" dicType="OrderItem">
            <parameter></parameter>
        </dicConvertor>
    </property>
    <!--医嘱大分类-->
    <property sourceName="ord_cate_code" targetName="Ord_Category" valueType="String">
        <dicConvertor methodName="getByCode" dicType="OrdCateage">
            <parameter></parameter>
        </dicConvertor>
    </property>
    <!--医嘱类型-->
    <property sourceName="ord_type_code" targetName="Ord_Type" valueType="String">
        <dicConvertor methodName="getByCode" dicType="OrdType">
            <parameter></parameter>
        </dicConvertor>
    </property>
    <!--周期-->
    <property sourceName="ord_period" targetName="Ord_Period" valueType="String">
    </property>
    <!--疗程-->
    <property sourceName="ord_duration_code" targetName="Ord_Duration" valueType="String">
        <dicConvertor methodName="getByCode" dicType="Duration">
            <parameter></parameter>
        </dicConvertor>
    </property>
    <!--用法 - 用药途径-->
    <property sourceName="ord_usage" targetName="Ord_Usage" valueType="String">
    </property>
    <!--频次-->
    <property sourceName="ord_freq_code" targetName="Ord_Freq" valueType="String">
        <dicConvertor methodName="getByCode" dicType="Freq">
            <parameter></parameter>
        </dicConvertor>
    </property>
    <!--医嘱开始时间-->
    <property sourceName="ord_startdate" targetName="Ord_StartTime" valueType="String">
        <dateConcatConvertor methodName="concatDatetime">
            <dateParameter value="ord_startdate"></dateParameter>
            <timeParameter value="ord_starttime"></timeParameter>
        </dateConcatConvertor>
    </property>
    <!--医嘱状态-->
    <property sourceName="ord_status_code" targetName="Ord_Status" valueType="String">
        <dicConvertor methodName="getByCode" dicType="OrderStatus">
            <parameter></parameter>
        </dicConvertor>
    </property>
    <!--医嘱数量-->
    <property sourceName="ord_orderqty" targetName="Ord_OrderQty" valueType="String">
    </property>
    <!--医嘱结束时间-->
    <property sourceName="ord_enddate" targetName="Ord_EndTime" valueType="String">
        <dateConcatConvertor methodName="concatDatetime">
            <dateParameter value="ord_enddate"></dateParameter>
            <timeParameter value="ord_endtime"></timeParameter>
        </dateConcatConvertor>
    </property>
    <!--开医嘱科室-->
    <property sourceName="ord_dept_code" targetName="Ord_Dept" valueType="String">
        <dicConvertor methodName="getByCode" dicType="Deptartment">
            <parameter></parameter>
        </dicConvertor>
    </property>
    <!--执行医嘱科室-->
    <property sourceName="ord_execdept_code" targetName="Ord_ExecDept" valueType="String">
        <dicConvertor methodName="getByCode" dicType="Deptartment">
            <parameter></parameter>
        </dicConvertor>
    </property>
    <!--归一后医嘱编码-->
    <property sourceName="ord_code" targetName="Ord_MedDicCode" valueType="String">
    </property>
    <!--归一后医嘱名称-->
    <property sourceName="ord_code" targetName="Ord_MedDicName" valueType="String">
        <dicConvertor methodName="getByCode" dicType="OrderItem">
            <parameter></parameter>
        </dicConvertor>
    </property>
</elasticMapper>