<?xml version="1.0" encoding="UTF-8"?>
<!DOCTYPE elasticMapper SYSTEM "elasticmapping.dtd">
<elasticMapper name="diagnose">
    <!--property配置字段映射信息
        sourceName：源字段名称
        targetName: 目标字段名称
        convert： 是否进行转换， 如果true, 则将通过调用方法或者动态执行sql获取转换后的值
        valueType: 字段数据类型，
        dicType: 字典类型   com.example.demo.core.dics 包下的类路径
        -->
    <property sourceName="diag_id"  targetName="Diag_Id" valueType="String" idField="true"></property>
    <property sourceName="diag_admid" targetName="Diag_AdmId" valueType="String" parentField="true"></property>
    <property sourceName="diag_regno" targetName="Diag_RegNo"  valueType="String" routingField="true"></property>
    <property sourceName="diag_date" targetName="Diag_Time" valueType="String">
       <dateConcatConvertor methodName="concatDatetime">
           <dateParameter value="diag_date"></dateParameter>
           <timeParameter value="diag_time"></timeParameter>
       </dateConcatConvertor>
    </property>
    <property sourceName="diag_type_code" targetName="Diag_Type" valueType="String">
        <dicConvertor methodName="getByCode" dicType="DiagnoseType">
            <parameter></parameter>
        </dicConvertor>
    </property>
    <!--诊断名称  通过编码获取-->
    <property sourceName="diag_name" targetName="Diag_Name" valueType="String">
        <dicConvertor methodName="getByCode" dicType="DiagnoseName">
            <parameter>diag_code</parameter>
        </dicConvertor>
    </property>
    <!--诊断编码-->
    <property sourceName="diag_code" targetName="Diag_Code " valueType="String"></property>
    <!--诊断顺位-->
    <property sourceName="diag_no" targetName="Diag_No" valueType="String"></property>
</elasticMapper>